{
  "task_id": "GAME-003-ART-DIRECTION",
  "owner": "art",
  "summary": "提交猫咪合成小游戏主体 Art Direction v0.1、Art Brief、Asset Manifest，以及10级猫咪体系、棋盘氛围、HUD视觉方向三类原创SVG概念稿。所有视觉产物均为概念阶段，等待用户审批后才能成为下游正式视觉输入。",
  "artifacts": [
    "deliverables/art/GAME-003-ART-DIRECTION/ART_DIRECTION_v0.1.md",
    "deliverables/art/GAME-003-ART-DIRECTION/ART_BRIEF_v0.1.md",
    "deliverables/art/GAME-003-ART-DIRECTION/ASSET_MANIFEST_v0.1.md",
    "deliverables/art/GAME-003-ART-DIRECTION/characters/CAT_TIER_SYSTEM_CONCEPT_v0.1.svg",
    "deliverables/art/GAME-003-ART-DIRECTION/scenes/PLAYFIELD_MOOD_v0.1.svg",
    "deliverables/art/GAME-003-ART-DIRECTION/ui_concept/HUD_VISUAL_DIRECTION_v0.1.svg"
  ],
  "acceptance_results": [
    {
      "criterion": "Art Direction 明确3-7个主体视觉关键词、设计理由、禁止偏离项和长期一致性规则，并保持原创猫咪主题，不复制参考游戏的受保护视觉表达。",
      "result": "PASS",
      "evidence": "ART_DIRECTION_v0.1.md 第1-4、7节定义6个关键词、设计理由、禁止偏离项、原创参考原则与长期一致性规则。"
    },
    {
      "criterion": "10级猫咪建立清晰视觉递进：每级在轮廓、体积感、识别特征上可区分，并与已批准PRD的尺寸基线兼容；不得因装饰造成明显视觉碰撞体错觉。",
      "result": "PASS",
      "evidence": "ART_DIRECTION_v0.1.md 第5.2节给出L1-L10视觉递进表；CAT_TIER_SYSTEM_CONCEPT_v0.1.svg展示10级体量与内部特征，并将配饰限制在主体轮廓内。"
    },
    {
      "criterion": "建立棋盘/场景、UI视觉、VFX视觉的共同语言和允许变化范围，使后续UI/VFX可在同一主体风格下工作。",
      "result": "PASS",
      "evidence": "ART_DIRECTION_v0.1.md 第5.4-5.6节覆盖场景、UI和VFX；PLAYFIELD_MOOD与HUD_VISUAL_DIRECTION提供对应视觉示意。"
    },
    {
      "criterion": "ART_BRIEF 与 ASSET_MANIFEST 明确首批概念资产的用途、状态、格式与生产边界，并区分概念稿和最终可集成资产。",
      "result": "PASS",
      "evidence": "ART_BRIEF_v0.1.md定义平台、用途与技术边界；ASSET_MANIFEST_v0.1.md将当前3类SVG标记为CONCEPT，并单列尚未创建的生产资产候选。"
    },
    {
      "criterion": "至少提供10级猫咪体系概念、棋盘氛围概念和HUD视觉方向概念三类可查看视觉产物；所有视觉产物在用户批准前均不得作为最终生产资产。",
      "result": "PASS",
      "evidence": "characters/、scenes/、ui_concept/ 下分别存在可本地浏览的SVG概念稿；文档和manifest均标记USER_APPROVAL_REQUIRED。"
    },
    {
      "criterion": "视觉方向不得改变已批准的核心玩法规则、UI交互语义或技术Contract。",
      "result": "PASS",
      "evidence": "Art Direction仅定义视觉语言；ART_BRIEF明确最终UI布局/交互由UI负责，技术尺寸/碰撞约束需与Tech/Client对齐。"
    }
  ],
  "assumptions": [
    "v0.1选择柔软圆润贴纸绘本感作为建议主体方向，仍需用户审批。",
    "SVG仅用于方向评审和本地快速迭代，不是最终运行时Sprite。",
    "当前未使用外部图片或商业素材作为生产来源。"
  ],
  "risks": [
    "如果后续最终角色视觉引入过长毛束、尾巴或配饰，可能造成视觉轮廓与碰撞体不一致，需要Art/Tech联合Review。",
    "L7-L10高等级装饰复杂度需要继续控制，以免堆叠密集时可读性下降。",
    "具体颜色在真机屏幕与最终背景上仍需UI/VFX阶段做可读性校验。"
  ],
  "status": "READY_FOR_REVIEW"
}
